asin,description,title,price
46,"The BIONIC SHIELD is our slim and chip-resistant glass screen protector.The BIONIC SHIELD is our slim and chip-resistant glass screen protector. It has all the great properties of the BIONIC SHIELD and it has also been reduced 28% in thickness and weight. Being made of glass, the edges of the screen protector are the most vulnerable to chipping. However, the round edges help to deflect shock from bumps and drops. The BIONIS SHIELD is made to protect the LCD from damages and scratches with specially processed glass that had been reinforced to increase shock absorbency. The entire surface of the BIONIC SHIELD is also transparent. When installed, there are no gaps between the LCD and the BIONIC SHIELD which means that the touch screen's sensitivity is not affected.This particular kit includes:&#x2022; Zeetron Bionic Shield&#x2022; Two metallic home buttons&#x2022; Microfiber Cloth&#x2022; Alcoholic pad&#x2022; squeegeeFeatures:&#x2022; Fingerprint resistant&#x2022; Scratch proof&#x2022; Waterproof&#x2022; No effect on touch sensitivityCompatible with&#x2022; iPhone 5&#x2022; iPhone 5S&#x2022; iPhone 5C1 Year Limited Warranty:Zeetron products are covered under a one year limited warranty  (Will not cover if the shield is cracked)",Zeetron Bionic Shield Premium Tempered Glass Screen Protector for iPhone 5 / 5S / 5C - Retail Packaging,9.99
47,,Lepow Moonstone 6000mAh External Battery for Smartphones and Tablets - Retail Packaging - Glossy Black,24.99
48,"ARCTIC Power Bank 2200 is an ultra-compact portable charger with 2200mAh capacity and 1.0Amp output power that is perfect for recharging your power-hungry smartphones or MP3 players without the bulk. The solid hi-tech all-aluminum cylindrical casing comes in 4 vibrant colors (black, blue, silver and pink) to complement your lifestyle. ARCTIC Power Bank 2200 conveniently fits into gym bags, purses, laptop bags and backpacks while serving as a reliable portable backup for your small mobile devices. Charging is as simple as connecting the cables between the devices. LED indicator keeps you informed about the charging progress. Built-in safety features such as auto-shutoff prevents unintentional overload and short-circuit, protecting your mobile devices. ARCTIC Power Bank 2200 comes with a 2-year limited warranty.","ARCTIC Power Bank 2200 Ultra-Compact Backup Battery/Charger, 1.0A Output 2200mAh for Smartphones/MP3 - Blue",14.95
49,"Bolse M3 is a line of portable external batteries designed for our modern mobile age. High capacity power and compact designs make these batteries a reliable power companion on the go.Compatible With:Apple iPhone 5, 4s, 4, 3Gs, 3G, 2G / iPod Touch / iPad 1 2 3 4 [OEM CABLE REQUIRED]HTC One X V S / Sensation XE XL / Thunderbolt / EVO 3DSamsung Galaxy S3 S2 Note / Epic 4G / Galaxy Nexus / Galaxy Tab seriesBlackberry Curve / Storm / Tour / Style / Bold / TorchMotorola Atrix / Bionic / Droid Razr Maxx, X , X2, 2 , 3, 4 / triumphNokia N900 / N8 / N97 / C6 / C3 / Lumia 800 900 700LG Optimus , 2x , V , S , T / Quantum / VortexSony Experia / X1 / X10 / X8 / Arc / Neo / Play / MiniAmazon Kindle Fire, HD, DX and all other kindlesPackage Includes:1 Bolse M3 External Battery3 connectors for most phones1 USB spring power wire1 Convenient travel pouch1 Instruction manual12 Month Manufacturer Warranty from Bolse","Bolse&reg; M3 6600mAh Dual Port External Battery Pack High Capacity Power Bank With Smart Digital Battery Indicator for Cellphones, iPhone 5, Tablets, Samsung Galaxy S4, S3, Note 2, HTC Sensation, EVO, One X, etc.",32.99
50,"About ZEEES KrakenZEEES Kraken is the world's largest capacity portable external battery with dual outputs designed for extending mobile device battery life. It features high energy density, fast charging time, compact design, and smart safety protection circuit, making it the most reliable power companion on the go. With an affordable price and great ZEEES customer service, you will enjoy your mobile life more than ever with the ZEEESTM Kraken.Popular Compatible Models:Apple:iPhone 6, 5S, 5C, 5 / iPhone 4S, 4, 3GS / iPod(Apple cable required)HTC:One X, S, V / Sensation, Sensation XE XL / EVO 4G / Radar 4G / Inspire 4G / Vivid 4G / Wildfire S / ThunderBolt / Incredible 2 S / Rezound / Desire X, C, V, HD, S, ZSamsung:Galaxy S5 S4 S3 / Galaxy Note 2 / Galaxy S2 I9100 / Galaxy S I9000 / Verizon Galaxy S3 I535 / AT&amp;T Galaxy S3 I747 / Sprint Galaxy S3 L710 / T-Mobile Galaxy S3 T999 / T-Mobile Galaxy S2 T989 / AT&amp;T Galaxy S2 I777 / AT&amp;T Galaxy S2 Skyrocket SGH-I727 / Galaxy Nexus / Galaxy Note / Focus S / InfuseMotorola:Droid Razr, Bionic / Atrix 2 / TriumphLG:G2, Nexus 4, Optimus 4X, 2X, V, S, T, 3D, 7Nokia:Lumia 920 900 710 800 / N8 / N9Others:Blackberry Torch Curve 9900 9360 9320 / Sony Ericsson Xperia Arc S, X10 / PSP / Nook Color / MP3 MP4 MP5 / GoPro","ZEEES KRAKEN 2600mAh (Silver) Premium Portable High Capacity External Battery Power Bank Backup Charger For Apple iPhone 6, 5S, 5C, 5, 4S, iPad, Air, Mini, Samsung Galaxy S5, S4, S3 Spare Battery Charger, Note, Nexus, LG, HTC One M8, Amazon Fire Phone",7.23
51,"Lots of JuiceThe 10000mAh Juice Box S2 Power Bank is designed to deliver long lasting, high capacity power to all of your mobile devices.The advanced technology and battery power packed into this powerful, durable, stylish, portable and light weight product will amaze and delight.Practical DesignThe device has a round button on the side to power on and off, and digital screen to display how much power is left. A really nifty feature is a flashlight that you can use in case of emergency or if there's a black out.Safety EnergyAdvanced power lock technology and ensure battery safety. The device will automatic shutdown when short circuit or over charging happened to avoid destroy the device and accident.Strong CompatibilityDual USB output ports, perfect for rapidly charging the external battery. The USB cable with 3 mobile phone/tablet connectors is compatible with many cell phones.CompatibilityIPhone 5S, 5, 4S, 4, 3iPad 4, 3, 2, Mini & iPodSamsung Galaxy S4, S3, S2, Note 1, 2, 3HTC One, Sensations G14 XE XL, EVO, Thunderbolt, Incredible, Droid DNAMotorola ATRIX, DroidGoogle Nexus 4, Nexus 7, Nexus 10LG OptimusPS Vita, GoProNokia N9 Lumia 920 900 / Blackberry Z10 / Sony Xperia ZZTET-mobile, Verizon, ATTPackage list10000mAh Power Bank x1, Three in One USB Cable x1, Velvet Bag x1, User Manual x1.Why Choose OXA?At OXA (More Juice - More Life) is not just a slogan. It is our commitment to you that we will deliver High Quality Products and Support for those Products to our customers before and after the sale. Search OXA on Amazon to get more items you need.","OXA Juice Box S2 10000mAh Safe External Battery 18M WTY Premium Samsung Cells Digital Screen&amp;Flashlight All-in-One charger external portable power supply for Apple iPhone 5, 4S, 4, 3, iPad 4, 3, 2, Mini, iPods Samsung Galaxy S4, S3, S2, Note 1, 2, 3; Nexus; HTC One, Sensations G14 XE XL, EVO, Thunderbolt, Incredible, Droid DNA; Motorola ATRIX, Droid; Google Nexus 4, Nexus 7, Nexus 10; LG Optimus; PS Vita, GoPro; Nokia N9 Lumia 920 900 / Blackberry Z10 / Sony Xperia Z; ZTE; T-mobile, Verizon, ATT, (5V 2A and 1A USB Output) Mirco USB connector and more",25.99
52,"Stylish & PortableIt is designed with stylish rectangle shape with the charming fresh fragrance to portable and small enough to fit in the pockets but also powerful, and could match with sleek good looks of mobile devices.Powerful CompatibilityCharge most mobile phones, such as iPhone, Nokia, Motorola, HTC, Samsung, LG, Blackberry, Sony Ericsson etc. Also support iPad, Kindle, Digital Camera, MP3/MP4 Players and other USB Devices.Reliable & DurabilitySamsung Grade A cell and premium microchips ensure high quality, reliable use up to 500+ battery charge cycles; Securely designed with three layers of smart safety protection including short-circuit protection, over current protection, overcharge protection.Ideal TravelmateIt can solve many mobile devices power supply problems in terms of power shortage and can make your devices work and travel carefree; And it is a perfect gift to your friends and family.Package list2600mAh Power Bank x1, USB Connector x1, Power Connectors x4Why Choose OXA?*Quality is the best salesman. Any items sold by OXA have 1 year guarantee from manufacturers. What's more, OXA will extend the warranty time for half a year.",OXA Perfume 2600mAh SAFE External Battery 18M WTY Premium Samsung Cells Key Chain charger external portable power supply (Check Amp for tablets) for Smartphones and other electronic devices,9.99
53,"Stylish and Powerful External Battery Designed for Travelling.Stylish and PortableDesigned for portability, stylish and lightweight, smooth to touch and easily put into your pocket or bag for use when you need it.Steady and ReliableAdvanced and intelligent chips provide overcharging, over-discharging, over-load and short-circuit protection, keep your devices have safe and reliable power.Indicator LED Lights4 LED lights work as charge indicators to show battery level or charging status, keep your gadgets going for long times and still have juice left to share.Practical DesignNot only charge your digital devices with 2 USB ports when travelling, but also give you a unique LED flashlight, no worry about the darkness.Package List:7800mAh Power Bank x1, USB Connector x1, Power Connectors x4, Velvet Bag x1, User Manual x1.Why Choose OXA?*Quality is the best salesman. Any items sold by OXA have 1 year guarantee. What's more, OXA will extend the warranty time for half a year.*OXA have professional staff to answer your questions, and we are ready to help you resolve any issues, no worry about after-sales service.*More juice, More life; OXA adhere to provide our customers with high quality products and excellent service, search OXA on Amazon to get more items you need.","OXA 7800mAh Juice Box S1 Portable External Battery Pack with Samsung Grade A cell Microchips and Dual USB Ports for iPhone 5, 4S, 4, 3, iPad 4, 3, 2, Mini, iPods; Samsung Galaxy S4, S3, S2, Note 1, 2, 3; Nexus; HTC One and More - Black",22.99
54,"EasyAcc make it easyEasyAcc PowerBank - make it easy to keep running all the timeWhy choosing EasyAcc iChoc M5 ?1. Fast charging: Save your time- Max input 2A, Charging the iChoc M5 fully just take 3.5 hours, 2.5 hours less than the older PowerBank with 1A input.- Max output 2.5A, Dual Output, double the output of the older version. It can serves your phone and your friend's at the same time in times of emergency.2. Build in Micro USB Charging Cable: Just take your iChoc, more convenient.Say goodbye to cable knots, With an intuitively-sized micro USB cord for Android, WIN8, and other Micro USB input devices; the iChoc allows you to carry your power all-in-one.3. Ultra Slim Design: Easy to carryJust 0.31 inch thin, one of the thinnest power bank in the world, iChoc Sized especially to stack behind your 4.7 inch phone, you can talk, surf or pocket the stacked combo.Specification:- capacity: 5000mAh / 18.5Wh- Input: 5V / 2A Max (Micro USB port, AC Charger or Charging Cable not included)- Output: 5V / 2.5A MaxOutput1: Micro USB port - 5V / 1AOutput2: USB port - 5V / 1A~2A- Size: 131 x 70 x 8.5mm- Net weight: 128gCompatible with all Apple and Android smartphones, tablets and other 5V input USB-charged devices. The iPod nano, iPod touch and some GPS and Bluetooth devices are not supported.Note: not fit for Samsung Tablets,Blackberry Phone,PSPUpgraded points:1. Higher input current, the former one 1A, now 2A,Time-Saving 2.5 hours2. Higher output current, maximum Output Current: 2A ~ 2.5A3. Add a USB output port, maximum possible output: 2A4. New LED flashlightWhat 's Included:1 x EasyAcc powerbank iChoc M51 x User Manual","EasyAcc&reg; 5000mAh 2.5A Dual Port Fast Charging Ultra-Slim Portable External Battery Charger Pack PowerBank built-in Micro-USB Cable and LED Flashlight for iPhone 5S 5C 4S (Apple adapters not included), Andorid Smartphone, Tablets, Bluetooth Speakers headset, Google Glass, Gopro and other devices - Matte Black",27.77
55,"Clear Voice Capture Technology:Not all the bluetooth device has good audio quality, Mpow FreeGo built-in CSR's own echo cancellation and noise suppression DSP software technology for enhancing the audio quality of wireless products.Features:Streams music and audio from your smart phone.Voice indication and Long standby time.The headset power can be indicated on iPhone.Streams music and audio from your cell phone, tablet, MP3 and almost all of devices with Bluetooth functionPlease note that this Bluetooth headset will be a little loose when you wear the glasses, if you usually wear the glasses. We advise you to choose theMpow Knight Bluetooth 4.0 headset.To get high charging speed in your car, we recommend the Mpow 4.2Amps 20W Dual USB Port Car Charger, please search ASIN:B00HLHHBHA to find it. Only $5.99 to get this car charger after you purchase the Mpow FreeGo headset, by using code MPOW42MA at checkout.Specification:Bluetooth Standard: Bluetooth V4.0.Chips: CSR8610 high-end chip from CSR PlcOperation: Class2.Bluetooth Mode: Headset/hands-free/A2DP/AVRCP.Frequency Range: 2.4GHz.Operation Range: Up to 30 feet (10meters).Talk/Playing Time: Up to 5 hours.Standby Time: Up to 120 hours.Charging Time: 2 hoursSize: 61.5x 23.5 x 15.5 mm.Weight: 0.02 poundsPackage included:1 x Bluetooth 4.0 headset1 x User guide3 x eartips (small, medium, large)1 x Micro USB charging cableWarranty:Every MPOW Product includes an 18-month, worry-free Guarantee!","Mpow&reg; FreeGo Wireless Bluetooth 4.0 Headset Headphone with Clear Voice Capture Technology and Echo cancellation for iPhone 5S 5C 5 4S, Galaxy Note 3 2 S4 S3 and other Cellphones",27.99
56,"Similar products are far more expensive. A great headset and value leader.Compare to headsets and headphones costing far more.Get in the groove wirelessly. Music lovers appreciate the thick bottom end.Although small and lightweight, these Bluetooth headphones offer a solid bass reproduction and clarity to awe your friends.No matter what you're doing, these headphones come along with you. Wear during workouts or when driving.With their lightweight and comfortable design, these headphones can be worn during long workouts or for hours behind the wheel. Never be without your phone or playlists.Distortion-free sound.Listen to all your music with the volume up high and never worry about distortion. Warning: Be careful about lending them to friends-you may not get them back!WeCare at BrightechAt Brightech, we stand behind all our products 100%. That's why we offer an industry leading 5-year satisfaction guarantee on all of our Bluetooth headphones. If for any reason you are not completely satisfied with your order, please contact us via email we will make sure to make things right!",Brightech - Active2&trade; Bluetooth Headset / Headphones with Mic for Wireless Streaming Music and Hands Free Calling,30.99
57,"Capacity, charge speed, or portability? With the Etronic Jupiter787, you get all three. Who would've thought that 10000mAh could be so compatible, light, and sleek? Intelligent circuitry provides safe and highly efficient charging. Top quality battery cells assure long life. Etronic's Jupiter Battery Series is fully compliant with international safety standards.Built-in LCD + Emergency Light TorchDesigned to be functional and efficient, the built-in LCD lets you know charging status and battery level with easy to read 0-100% digital battery indicator. No more guessing, know exactly how much juice is left to better managing all your devices. We also include a bonus Emergency Light Torch feature to help you find ways in the dark.Choose Your PersonalityPick a Jupiter that maches your style in Jet Black or Alpine White.Device Compatibility* APPLE: iPhone 5 4S 4 3 3GS / iPod Touch/Classic/Nano/ iPad Retina/Mini/2 [OEM or LIGHTNING CABLE REQUIRED]* HTC: One X V S / Sensation XE XL / Thunderbolt / EVO 3D / EVO 4G / Evo Shift 4g* SAMSUNG: Galaxy S4 S3 S2 S / Note 1 2 / Epic 4G / Galaxy Nexus* Any other mobile devices that can charge through USB portPackage and Warranty- Jupiter787 Battery Pack- User Guide- 1x Micro USB Cable + 1x Universal Cable for Apple (30-pin), Nokia, and MicroUSB.- The Jupiter787 Battery Pack backed by a Etronic Limited 1 Year Warranty.",Etronic Jupiter787 10000mAh Portable High Capacity 5V 3.1A Dual-USB-Port External Battery Power Bank Backup Charger [Built-In LCD Indicator + Built-In Emergency LED Flashlight + Micro USB / Apple 30-Pin / DC2.0 Adapters + Travel Pouch] - Jet Black,29.99
58,,"ARCTIC P402BT Bluetooth Stereo Headphones with Integrated Mic, A2DP/AVRCP, 30-Hour Playback for Tablet/Smartphone/MP3 - Black",54.89
59,"These Styli unlock the full potential of your iPad, iPhone, Kindle Fire, Samsung Galaxy or other Touch Screen Device. Don't limit yourself to the precision of your fingertip. Fingers are great for painting when you are 4 - but, if you really want to touch, type, innovate and design on your device you need a capacitive stylus. These Styluses makes it easy to turn a page, pick a movie, draw a picture and keeps pesky fingerprints off your glossy screen. The stylus's durable rubber tip connects your brain to your device - requires no power, no drivers and no setup - just open the package and create - or escape.Have a young one using your device - using a pen like stylus is proven by educational experts to help them develop the motor skills and eye hand coordination they will need when learning to write with the modern day quill and feather.Product highlightsThe tip of the stylus engages directly with your electronic, touch-screen device, requires no power or software to operate and instantly works right out of the box.Compatible with many SmartphonesApple: iPhone 5/ iphone4s/ iPhone 4/ iPhone 3Gs/ iPod Touch/Classic/NanoSamsung Galaxy Note/Galaxy S3/Galaxy S2 / Galaxy Nexus /All other Samsung cell phonesHTC Evo Shift 4G and all other HTC cell phones.Motorola Razr/Atrix / Bionic/ Droid X , X2/ triumph/All other Motorola cell phonesBlackberry Tour/Storm 2/Curve/ Bold/ Blackberry cell phonesTabletsiPad (4th gen) with Retina display, the NEW iPad (3rd gen), iPad2, iPad, Nook COLOR, Nexus 7, Galaxy Note, Galaxy Tab, Asus Transformer series, Motorola XOOM, Dell Streak 7,   ASUS Eee Slate","Sty-HD 2 Pack of Premium Precision Micro-Knit Hybrid Fiber Tip Capacitive Stylus Pens for iPhone 5 4 4s, iPod touch, All iPad: 1st Gen, 2, the NEW iPad, iPad 4th gen with Retina display, iPad Mini, Samsung Galaxy Tablet and Phone Black and Silver Color",9.99
60,"""Two in one smart design feature""This luxury-grade offering from Sty-HD is really a great addition to the office and offers the certainty that your electronic accessories look as professional as you require them to. The sleek, black look and high quality pen-stylus combo is designed for business executives, CEOs and those out to impress. The stylus is designed to be compatible with almost all touch-screen devices and is perfectly weighted for easy sliding.All our packaging is recyclable and designed to be totally frustration-free: no fiddly wire-ties or annoying hard plastic clamshells or blister packs.Move and type with confidence with this beautiful Sty-HD offering!","Business Stylus Executive Pen - Capacitive Stylus Touch Screen Cellphone Tablet Pen for iPhone 5 4 4s 3 3Gs iPod Touch iPad 2 3 4 Motorola Xoom, Samsung Galaxy S4 S3, Barnes and Noble Nook Color, Droid Bionic",8.99
61,"Real 3100mAH Capacity! No inflated capacity rating or BS like other brands! We also make the Thinnest and Fastest External Battery Pack in the World!The best mAh/$ Value in Market Guarantee!Don't like it? Return it! We are confident that you will not be returning since no one can beat this mAH/$ savingsSPECS:Input: 5V/1.5A. Charge time 2 hours =FASTEST INPUT CHARGE FOR 3000mAh CLASS IN THEWORLD!Output:1 standard USB port@2.1A =FASTEST OUTPUT CHARGE FOR 3000mAh CLASS IN THE WORLD!Include: Flat line microUSB Charging Cable9999 Days Warranty - Longest in Industry:How about a 9999 Days Warranty to keep you as our happy customer?Each battery pack comes with 9999 Days Warranty. This Warranty is longer than all your devices warranty period combined!For most batteries on the market, this energy loss reduces the effective capacity by up to 30% of the total power of an external battery. Their total energy conversion rate (TECR) is @ a mere 70%. 5 Star America's highly advanced batteries have an astonishing 85% TECR.We achieve these results by employing a design that includes the best internal batteries made for LG phones, Made in Japan control chip and an aluminium battery heat transfer method that keeps heat away from the internal components. Our batteries can go through over 500 full charge/discharge cycles over the life of the product.Charge-Through TechnologyMost batteries we encountered are not capable of charging other devices while the external batteries are getting charged. To make life simpler we have a battery that can do both at the same time.Only products in Fulfillment by Amazon Program are authorized Resellers","[9999 DAYS WARRANTY]3100mAh External Battery Charger by 5 Star America **THINNEST + FASTEST CHARGING EXTERNAL BATTERY PACK IN THE WORLD 2A Output** Color:Black/Black for iPhone 5s/5/5c (Lightning Adapter not included) 4S 4 3GS, iPod, Samsung Galaxy Note 1/2/3, Galaxy S4, Galaxy S3, Galaxy S2, Galaxy Nexus, HTC One X, One S, Sensation G14, ThunderBolt, Nokia N9 Lumia 1020 920, Blackberry Z10, GoPro and other-Best mAh/$ Capacity Value (5S-31-Black/Black)",8.99
62,"ARCTIC S113BT is a portable wireless speaker system that combines the best of both worlds: one-touch pairing through Near Field Communication (NFC) and extended range through Bluetooth 4.0. NFC cuts the pairing process to a fraction of a second and is as easy as putting your Android device on top of the ARCTIC S113BT. Powerful Bluetooth 4.0 connectivity gives you true stereo sound far superior than what the tiny speakers from your mobile device can ever produce even with your device is 30 feet away from the ARCTIC S113BT! ARCTIC S113BT supports the same high quality Advanced Audio Coding (AAC) digital audio format popularized by YouTube, iPhone, iPod, iPad, Nintendo & PlayStation 3 and delivers better sound quality than MP3 at similar bit rates. ARCTIC S113BT is also compatible with aptX digital audio codec compression technology that brings you high quality audio virtually identical as wired speakers with an impressive dynamic range and crisp clarity. Standard 3.5mm audio cable is provided if you prefer wired connection. Dual full-range drivers & two bass radiators deliver excellent sound indoor and outdoor. Built-in rechargeable battery provides up to 8 hours of playback in a single charge. ARCTIC S113BT has a rubberized protective casing in a petite footprint of only 7""x3""x2"" that weighs only 14 oz. A padded nylon carrying case keeps it safe and dry wherever you go. The integrated omni-directional microphone in ARCTIC S113BT turns it into your portable speaker box in the car or in conference room. ARCTIC S113BT supports NFC and/or Bluetooth-enabled devices running iOS/Android/Windows. Feel free to pair ARCTIC S113BT with your smartphones, tablets, e-reader, MP3, laptop and even desktop enjoying full stereo audio without tangling speaker wires. ARCTIC 113BT comes with a 2-year limited warranty and there are 6 different colors to choose from for different lifestyles. Contact arctic.us@arctic.ac for services.","ARCTIC S113BT NFC/Bluetooth 4.0 Stereo Speaker, AAC/aptX, Build-in Microphone for Hands-Free Calls, White",46.95
63,,"DKnight Magicbox Ultra-Portable Wireless Bluetooth Speaker,Powerful Sound with build in Microphone, Works for Iphone, Ipad Mini, Ipad 4/3/2, Itouch, Blackberry, Nexus, Samsung and other Smart Phones and Mp3 Players [[Upgraded with standard &quot;Beep&quot; sound prompts] (Red)",39.99
64,"The 9to5Cables 3.1A 15W Dual Port USB Wall charger is perfect for people with multiple devices. The Dual Port allows you to simultaneously charge your iPad and another tablet or your Smartphone. Built to our exacting specifications, it has never been easier to charge your two smartphones, or smartphone and tablet, at the same time!. It is compact with high quality finish and comes with 9to5Cables 1 year warranty.High Speed Dual ChargeWith the 9to5Cables Smart Charge capabilities, the Rapid USB Car Charger will detect your devices battery charge and adjust output power to get your device 100% charged as quickly as possible.Overcharge Protection9to5Cables Dual 15W USB Wall Charger  includes Smart Charge technology that recognizes when your device is fully charged, preventing your device from being overcharged, which degrades your device battery.Compatible DevicesUSB Port 1 (labeled as UNI 1A,designed for non apple products) CompatibilityiPhone / iPod Touch @ 0.5 Ampere Max.Androids phones / GPS / Tablet etc. @ 1 to 3.1A Ampere Max.NOTE""Currently known support tablets: Samsung Galaxy Tab / Note Series, Amazon Kindle Fire & all other Kindles,Nook Color, HTC Flyer, Huawei Tablets.NOT compatible with HP TouchPad, Asus transformer or Motorola Xoom.May not be compatible with some Blackberry & Motorola Phones.USB Port 2 (labeled as APP 1-2.1A-  Designed for Apple products) CompatibilityiPad @ 2 Ampere Max.iPhone / iPod Touch @ 1 Ampere Max.Others phones / GPS / Tablet etc. @ 0.5 to 3.1A Ampere Max. (May not support charging / or slow charging with some devices)WarrantyCovered by 9to5Cables Lifetime Warranty.",9to5Cables Dual USB 3.1A (15W) Wall Charger [UL Certified] - Designed for Apple and Android Devices - Smart Charge Technology - Flip Down Plug - Lifetime Warranty - BLACK,10.99
