asin,description,title,price
0,"TheIncredicharge I-5000External Battery Pack will extend the battery life of your device by up to 300% of its normal capacity! This device with its 2 USB ports accommodates convenience in its design - allowing charging or use of multiple devices at once.  Never again will you have to waste time while travelling looking for an outlet to charge your mobile device.The power supply unit is equipped with a 5000mAh battery making it compatible with most mobile devices including:- iPhone , 3G, 3GS, 4, 4S- iPod Touch 2G, 3G, 4G 5G- iPod Video Classic 30GB, 60G, 80GB- HTC Android, Droid, Blackberry, Samsung Galaxy, Kindle, LG, Palm- Nintendo DS, Nintendo DS lite, Nintendo 3DS, Sony PSP (Adaptors sold separately)Key Features:- 5000mAh battery Capacity- 2 USB ports for multiple charging- Sturdy buttons.- LED battery gauge indicator.- FlashlightThis unit is backed by the ""Incredicharge"" 12 month product warranty.","Incredicharge I-5000 External Battery Pack and Charger 5000mAh Capacity for Apple Iphone 4 4s iPod Touch (1G 2G 3G 4G 5G), Motorola Droid Razr MAXX, HTC Android EVO, Blackberry, Samsung EPIC, Samsung Galaxy Tablet, Samsung Galaxy S2 S3 and Many More Devices",17.95
1,"PowerGen PGMPP8400 has a convenient dual USB port design for charging two device simultaneously. Intelligent circuitry provides safe and highly efficient charging. Top quality battery cells assure long life. PowerGen Battery Pack is fully compliant with international safety standards.Compatible with:AppleiPhone 5s 5c 5 4s 4 3Gs 3G 2G / iPod Touch / iPad 1 2 3 4 Air mini Retina[OEM CABLE REQUIRED]HTCOne X V S / One mini, MaxSamsungGalaxy S5 S4 S3 S2 Note / Epic 4G / Galaxy Nexus[NOT Compatible with Galaxy Tab series or Asus Transformer]BlackberryCurve / Storm / Tour / Style / Bold / TorchMotorolaAtrix / Bionic / Droid Razr Maxx, X , X2, 2 , 3, 4 / Moto X GNokiaLumia SeriesLGOptimus G G2 G ProSonyExperia / X1 / X10 / X8 / Arc / Neo / Play / MiniAmazonKindle Fire, HD, DX and all other kindlesBuy with ConfidenceShipped by Amazon7*24 hours Support1 Year Limited replacement warrantySpecs:- Fully Charged by 1A Adapter: 9-10hrs- Fully Charged by 10w Adapter (Not included): 5-6Hrs- Life Cycle  > 500 Times- Input: DC 5V / 1500mA- Output1 : DC 5.3V / 2000mA and DC5.3v / 600mA- Dimension: 3.8 x 2.5 x .87 in.Accessories:- 5 Connectors ( 2xMicro USB, 1xNokia DC 2.0, 1xMini USB, and 1xPSP)- Two Extension cables",PowerGen&reg; 8400mAh External Battery Pack High Capacity Power Bank Charger Dual USB 2.6Amps output for Apple and Android Devices,29.99
2,"These Styli unlock the full potential of your iPad, iPhone, Kindle Fire, Playbook, or other Touch Screen Device. Don't limit yourself to the precision of your fingertip. Fingers are great for painting when you are 4 - but, if you really want to touch, type, innovate and design on your device you need a capacitive stylus. These Styluses makes it easy to turn a page, pick a movie, draw a picture and keeps pesky fingerprints off your glossy screen. The stylus's durable rubber tip connects your brain to your device - requires no power, no drivers and no setup - just open the package and create - or escape.Don't limit yourself to the precision of your fingertip.Fingers are great for painting when you are 4 - but, if you really want to touch, type, innovate and design on your device you need a capacitive stylus.These Styluses make it easy to turn a page, pick a movie, draw a picture and keeps pesky fingerprints off your glossy screen.The stylus's durable rubber tip connects your brain to your device - requires no power, no drivers and no setup - just open the package and create - or escape.","Sty-HD 9 pcs Rainbow of Colors Capacitive Stylus/Styli Touch Screen Cellphone Tablet Pen for iPhone 4 4s 3 3Gs iPod Touch iPad 2 Motorola Xoom, Samsung Galaxy, BlackBerry Playbook AMM0101US, Barnes and Noble Nook Color, Droid Bionic",9.99
3,"The Capacitive Stylus unlocks the full potential of your iPad, iPhone, Kindle Fire, Playbook, or other Touch Screen Device.Don't limit yourself to the precision of your fingertip.Fingers are great for painting when you are 4 - but, if you really want to touch, type, innovate and design on your device you need a capacitive stylus.These Styluses make it easy to turn a page, pick a movie, draw a picture and keeps pesky fingerprints off your glossy screen.The stylus's durable rubber tip connects your brain to your device - requires no power, no drivers and no setup - just open the package and create - or escape.","Sty-HD 17 pcs Colorful 3 Styles Capacitive
Stylus/Styli Touch Screen Cellphone Tablet
Pen for iPhone 4 4s 3 3Gs iPod Touch iPad
2 Motorola Xoom, Samsung Galaxy,
BlackBerry Playbook AMM0101US, Barnes
and Noble Nook Color, Droid Bionic",12.99
4,"The iHangy Music Necklace is a convenient all-in-one way to keep your iPhone/iPod secure around your neck and listen to music hands-free. No more pockets, straps or armbands, simply clip the iHangy onto your Apple device, hang around your neck and the built in ear buds are ready to for listening when you're on the go",iHangy IHG-ONT-84709 Adjustable Lanyard Music Necklace and Earbuds for iPhone 3/3G/4/4S/iPod - 1 Pack - Retail Packaging - Black,19.95
5,,"Incredisonic IFM-500 Bluetooth FM Transmitter Hand-Free Car Kit With Goosneck GPS Vehicle Mount Combo, for Iphone 5 4 4S 3GS, Ipod Touch All Versions, Samsung Galaxy Nexus S2, &amp; S3, HTC Sensation EVO Thunderbolt, Motorola Razr &amp; Bionic, &amp; All other Android &amp; Windows PDA phones, SIRI Compatible",29.95
6,"Toddy Gear was founded by Todd Gabel as the beginning of an extraordinary, worldwide movement to clean every gadget, every screen, and color the world. Toddy Gear's Ready, Set, Cheer! line can help you express your Olympic and national loyalties with a variety of flag-pattern prints. The Toddy Gear Smart Cloth is a functional and fashionable microfiber cloth carefully crafted for effective, scratch-free cleaning of extremely sensitive surfaces. This stylish double-sided wonder cloth has a plush microfiber that doesn't just spread dirt and oil from your fingerprints around on your e-screens. It whisks them away with a couple of simple swipes, leaving you with that 'out of the box', clean feeling - and nothing feels better than a brand new gadget with that out of the box, clean feeling! Flip your Toddy Gear over, and the silky, decorated side polishes your device even further, while its tactile pleasantness tempts you to just rub it against your face like your beloved childhood blankie. Machine-washable and dryable on low heat. The AEGIS&#xA0;Microbe Shield protects against germs mildew and mold between launderings. The Toddy Gear Smart Cloth was developed to clean the world's e-screens effortlessly, effectively, and with a style that's totally fierce. Once you have got one, it will never leave your side!",Toddy Gear 15X7B11312 Union Jack 5 x 7 Inches Premium Microfiber Smart Cloth for Screen and Glass Cleaning - 1 Pack - Retail Packaging - Red/White/Blue,9.99
7,"Yubi Power High capacity power bank is Produced with the highest standards and quality in mind. Intelligent circuitry provides safe and efficient charging. Top quality high tech battery cells with protection board, ensures long life and protection against over charge, over voltage, over current, and short cirtuit protection. Intelligent LED shows the current power level. This power bank is ideal for most digital devices with DC5V input, such as iPhone, iPad, Smartphones, PSP, Mp3, GPS, Amazon kindle, Google Nexus, etc.Specs:- Average Charging time for iPhones 1.5 hrs- Input Charging Time 5 - 6 hrs- Life Cycle > 500 Times- Input: DC 5V- Output: DC 5v- Dimension: 100x42x23mm- Battery capacity: 5200mAhCompatible with Most Cell Phones:Apple:iPhone 4S /4 /3GS/and iPhone 5/ ipod touch/classic/nano/ iPad/ iPad 2 iPad 3 and 4 [OEM CABLE REQUIRED]HTC:Sensation XE XL / Thunderbolt / EVO 3D / EVO 4G / Incredible S / Evo Shift 4g ...Samsung:Galaxy S 2 / Epic 4G / Galaxy S 4G / Galaxy Nexus ...Blackberry:Curve / Storm 2 / Tour Style / Bold ...Motorola:Atrix / Bionic / Droid X , X2, 2 , 3, 4, Pro , R2D2 / triumph ...Nokia:N900 / N8 / N97 / C6 / C3 C7 / E7 / X6 ...LG:Optimus , 2x , V , S , T / Quantum / Vortex ...Sony:Experia ARC Arc / Neo / Play / Mini ...Amazon:Kindle Fire, and all other kindles ...Others:Nook Color, NDS, Portable Wifi, PSP... etc.Package Includes:5200mAh Yubi power bankUser Guide30 pin connector for Apple devices, Micro/mini usb connector, Usb port.",Stay Powered with Yubi Power YP520A 5200mAh External Battery Charger with LED Flash Light,16.95
8,"Features:World's highest capacity for Galaxy SIII @ 7000mAh-More than 3 times the capacity of original Galaxy SIII Battery and 1 time more than other makers' Galaxy SIII Extended BatteriesZeroLemon in house engineered Full Edge Wrap TPU case-World's only maufacturer to integrate both back cover and case into one for ultimate drop protection.NFC Built into the battery-All functions on Galaxy SIII such as S Beam and Google Wallet are activated-------------------------------------------We engineered the world's highest capacity battery for Galaxy SIII while providing a full edge wrap case to protect your valuable phone. We acheived these features while maintaining the same phone thickness as other makers' lower capacity batteries. This 7000mAh battery nearly doubles the capacity of iPad Mini Tablet! (iPad Mini rated at 4490mAh)For other ZeroLemon's Galaxy SIII batteries, please click on ZeroLemon under the title-------------------------------------------*Must use included Soft Plastic TPU case with this batteryDue to oversize capacity, phone will show battery at 3% for slightly prolonged period, this is normal behavior*Actual battery life will vary depending on your hardware and software configurations and network conditions.*To charge the extended capacity & battery charge for 2-3 hours after 100% charge.","[180 days warranty] ZeroLemon Samsung Galaxy S III 7000mAh Extended Battery + Free White Extended TPU Full Edge Protection Case(Compatible with Samsung Galaxy S III GT-i9300, AT&amp;T Samsung Galaxy S3 Samsung i747, Verizon Samsung Galaxy S3 Samsung i535, T-mobile Samsung Galaxy S3 Samsung T999, U.S. Cellular Samsung Galaxy S3 R530, and Sprint Samsung Galaxy S3 Samsung L710) ***NFC for S Beam and Google Wallet***- WORLD'S HIGHEST S3 BATTERY CAPACITY **USA PATENT PENDING DESIGN**- White",42.99
9,,"Bolse Mini Windshield Car Mount Holder for iPhone 5 4s Samsung Galaxy S3/S2 Note HTC Evo 4G LTE Rhyme Incredible 2 LTE, 360 degree Rotatable",21.74
10,"FRIEQ Aluminum Home Button Sticker perfectly protect your iPad, iPhone, iPod from scratch and dirty. And it's designed to give an unique look of your Apple product. Our Home Button Sticker is made with 100% real aluminum, high quality and lightweight. It's made with diamond cutting on the edge so that he home button shines at different angles. It's easy to stick on the home button and also easy to remove by peeling.This package includes 4 colors (black/silver/purple/blue) for you to choose.","FRIEQ&reg; ST1 Aluminum Home Button Sticker Comes With Black, Silver, Blue, Purple For iPhone 5 / 4s / 4, iPad, iPod Touch",9.99
11,"SPIGEN SGP Slim Armor case for the iPhone 5/5S is specifically designed to protect the iPhone 5/5S at all angles. The TPU case features improved shock absorption on the top, bottom, and corners to effectively protect the iPhone 5 from external impact. Slim Armor is double layered with a TPU case and a polycarbonate hard case to provide additional protection in a form-fitted design. The polycarbonate midsection has a metallic finish and can be removed from the TPU. This allows the Slim Armor to be interchanged with different colors. The case fits precisely onto the iPhone 5/5S for a natural and sleek look, and the speaker opening is specifically designed to fully utilize the speaker without reducing sound quality. The polycarbonate midsection has a matte finish coating design to provide the best grip with a soft touch. Slim Armor is designed to highlight the two-toned colors and structural edges of the back of iPhone.","iPhone 5 Case, Spigen Slim Armor Case for iPhone 5S/5 - 1 Pack - Retail Packaging - Metal Slate (SGP10088)",14.99
12,,"Incredicharge I-10 External Battery Pack High Capacity Charger 10400 mAh Capacity With Dual USB output for Samsung Galaxy S4 S IV S3 S2 S 2 II Apple iPhone, iPod Touch, Motorola Atrix 2, Droid 3 X X2 Razr HD Maxx, Bionic, Triumph, Nokia Lumia and GoPro Cameras, Comes W/Built-in Micro USB Cable",17.95
13,"When you need a raincoat to venture out into a storm why expose your expensive smartphone to the elements all by itself? The FRIEQ Universal Underwater Case acts as a barrier between the phone and the environment protecting it from liquid spills and even preserving its functionality under water!Protection Guaranteed Even UnderwaterNever again have to worry of losing your important phone data due to liquid seepage. Be it rain, a quick dip in the sea or a sauna session, the FRIEQ Universal Waterproof case will keep your phone safe, sound and dry - IPX8 certified to 100 feet or 30 meters.Unhindered ViewJust because your phone is enclosed in a waterproof case doesn't mean that it can't be accessible. With Crystal Clear windows to both sides, taking videos and pictures is no different than without the case. Designed to allow touchscreen functionality, touch and type away on your phone even while underwater!Snap Lock MechanismEasy to use, this waterproof case features a simple snap locking access that can quickly seal your precious smartphone before the storm sheds its weight.Universal DesignCompatible with all touch phones, it works with the latest high end devices such as iPhone 5, 5C & 5S, HTC One/One X/X+, Note 2, Note 3, Nexus 4, Droid Incredible, Droid DNA, Windows Phone 8X, Nokia Lumia and Samsung Galaxy S5, S4, S3 and more. Will easily accommodate any smartphone under 5.3"".","FRIEQ Universal Waterproof Case for Apple iPhone 5s, 5, Galaxy S5, S4 S3, HTC One X, Galaxy Note 3, 2 - IPX8 Certified to 100 Feet",9.99
14,"FRIEQcleaning pad is made of premium microfiber material, effectively removes fingerprints and residue from the screen without using a cleaning solution.Soft, comfortable and scratch-resistant that is safe to use on the screen.It works with the ipad, iphone, lcd, cell phone, Mp4, PSP and all touchscreen devices.Reusable cleaning pad to help effectively remove fingerprints and residue from the screen, and it is sized perfectly, easy to grip and use.","FRIEQ&reg; Premium Microfiber Cleaning Pads for Ipad, Iphone, Lcd, Cell Phone, and Touchscreen Devices (3 Pack)",4.71
15,"FRIEQWide Grip Capacitive Stylus, designed sleek, stylish, and functional is compatible with all capacitive touch screens, just like iPad, iPhone, Kindle Fire, Galaxy Tab and so on.It is made from premium aluminum with a soft touch pen-point for better screen-protection, was created to be compact and durable.Precise touch and control, easily avoid pressing the wrong keys even if you are wearing gloves.One-Year Limited Warranty",FRIEQ Wide Grip Capacitive Stylus Pen for Touchscreen Devices,9.99
16,,"uNu Power DX External Protective Battery Case for iPhone 5s / iPhone 5 - MFI Apple Certified (Matte Black, Fits All Models iPhone 5S &amp; iPhone 5)",59.9
17,"Yubi Power High capacity power bank is Produced with the highest standards and quality in mind. Intelligent circuitry provides safe and efficient charging. Top quality high tech battery cells with protection board, ensures long life and protection against over charge, over voltage, over current, and short circuit protection. Intelligent LED shows the current power level. This power bank is ideal for most digital devices with DC5V input, such as iPhone, iPad, Smartphones, PSP, Mp3, GPS, Amazon kindle, Google Nexus, etc. Specs, Average Charging time for iPhone's are 1.5 hrs., Input Charging Time 9 hrs., Life Cycle greater than 500 Times, Input: DC 5V, Output: DC 5V 2.1A, Dimension: 100x60x24mm, Battery capacity: 8400mAh Compatible with Most Cell Phones: Apple: iPhone 4S/iPhone 4/iPhone 3GS/iPod touch/classic/Nano/iPad/iPad 2 [OEM Cable Required] HTC: Sensation XE XL/Thunderbolt/EVO 3D/EVO 4G/Incredible S/Evo Shift 4g. Samsung: Galaxy S 2/Epic 4G/Galaxy S 4G/Galaxy Nexus .Blackberry: Curve/Storm 2/Tour Style/Bold . Motorola: Atrix/Bionic/Droid X, X2, 2, 3, 4, Pro, R2D2/triumph. Nokia: N900/N8/N97/C6/C3 C7/E7/X6 .LG: Optimus, 2x, V, S, T/Quantum/Vortex . Sony: Xperia ARC Arc/Neo/Play/Mini. Amazon: Kindle Fire, and all other kindles, Others: Nook Color, NDS, Portable Wi-Fi, PSP. etc. Package Includes: 8400mAh Yubi power bank, User Guide 30 pin connector for Apple devices, Micro/mini usb connector, 2 Usb ports.",Yubi Power YP840A 8400mAh Portable Power Bank Backup External Battery Charger for iPhone 3/4/5 and Samsung Galaxy 2/3 (Black),29.99
18,"Easily charge your USB powered devices such as your iPad, iPod, iPhone, 
Samsung, Android, cellular phones, MP3 players, PDAs and GPS. This charger 
allows for two of your devices to be simultaneously charged.Specs:- Average Charging time for iPhones 1.5 hrs- Input Charging Time 5 - 6 hrs- Life Cycle &gt; 500 Times- Input: DC 5V / 1000mA- Output: DC 5.3V / 2600mA (Dual USB: 0.6A+2A=2.6A)Compatible with Most Cell Phones:Apple:iPhone 5 /4S/4/3GS/3G ipod touch/classic/nano, iPad 1/2/3/4, iPad 
Mini (Support All iPad/iPhone/iPod Models)HTCSensation XE XL / Thunderbolt / EVO 3D / EVO 4G / Incredible S / Evo 
Shift 4g ...SamsungGalaxy S 2 / Epic 4G / Galaxy S 4G / Galaxy Nexus ...MotorolaAtrix / Bionic / Droid X , X2, 2 , 3, 4, Pro , R2D2 / triumph 
...NokiaN900 / N8 / N97 / C6 / C3 C7 / E7 / X6 ...LGOptimus , 2x , V , S , T / Quantum / Vortex ...SonyExperia ARC Arc / Neo / Play / Mini ...AmazonKindle Fire, and all other kindles ...OthersNDS, Portable Wifi, PSP(NOT compatible with PSP vista)Package Includes:&nbsp;- iFlash 8400mah Battery Pack- User Guide- AC Wall Charger- Two Charging cables w/ 5 connectorsBuy with Confidence1 Year Limited Replacement Warranty","iFlash Dual USB 8400mAh 2.6A Heavy Duty Output External Battery Pack Charger for Smart Phones, Android Phones, iPhones, iPads, Galaxy, HTC, Nokia, Motorola and various other smartphones - Black Color, Retail Package",26.99
19,"Intocircuit - Expert in Circuit DesignIntocircuit, devoted to the design and manufacture of consumer electronic gadgets, always keeps up with the latest state-of-the-art innovations. To keep your portable digital devices portable, Intocircuit proudly release our power bank product series with top-quality and high-reliability.Specifications:-Model: Intocircuit Travi Series T5000-Capacity: 5000mAh-Input: 5V 1A A full charge takes 5.5-6 hours.-Output: USB 5V 1A-Size: 97*44*23mm-Net Weight:122gBattery Life Extension:-2 full charges to iPhone 4S 4 3G-1-2 full charges for Samsung Galaxy S3-2-3 full charge for other mobile phonesSecurity Protection:Multiple safety protection mechanisms: protection against overcharge, overload, overvoltage, over-current, and short circuit.Popular Compatible Models:(Not a full list)-LG: Nexus 4, Optimus..-Nokia: N9/Lumia800/900/920..-Kindle/ Google Nexus 7 / Kindle Fire .-Motorola:Atrix 2/ Droid X/Triumph/Droid 3/Razr .-Samsung:Galaxy S3/Galaxy Note 2/Galaxy S ii/Galaxy note..-HTC: One S/X/XL/Sensation 4G/XE/ EVO 4G/Inspire 4G..-Apple:iPhone 5/iPhone 4/4S/iPhone 3GS/ipod touch/iPad 2/new iPad[Lightning Cable is not included]-Others: Blackberry Bold 9900 / Sony Ericsson Xperia Arc SPackage includes:1* T5000 Power Bank6* Connectors for most phones1* Charge cable1* Handy carry pouch1* User manual","Intocircuit T5000 5000mah External Battery Pack High Capacity Power Bank Charger for Apple: Ipad Mini, Iphone 5s, 5c, 5 (Lightning Cable Not Provided)/iphone 4s, 4 3gs 3g Ipad 2, Ipod Touch; Most Android Phones: Samsung Galaxy S3 I9300 S2 S Ii I9100, Galaxy Nexus, Galaxy Note 2; HTC Sensation, One X V One X V S, EVO 4g, Thunderbolt; Nokia Lumia 920 900 N9; Motorola Razr; Lg Optimus; Psp; [Built-in Flashlight, 6 Connectors, 1 Charging Cable, Handy Carry Bag Included with 12 Month Warranty]",19.99
20,"Bolse4 Port USB Wall/Travel/AC Rapid Charger (4 Amps / 20Watt / Fastest Speed) is designed to charge multiple power hungry tablets, phones, power banks and other USB devices (GPS, bluetooth headset, portable Wifi, MP3 players, 3D Glasses etc) at fastest possible speed.This charger charges tablets at 2 Amps and most phones at 1 Amps current.
This results in fastest possible charging of your device.USB Ports:Port 1 & 2(Universal): Designed based on latest USB charging standard and will charge almost all devices including Apple & Android devices.Port 3(Universal/iDevice Legacy): This port will also charge most devices (including iPad) but this port has support legacy/old Apple devices. If you face any problem charging your Apple devices with Port 1&2, please use this port.Port 4(Universal/Samsung Optimized): This port is specifically designed to charge Samsung devices(e.g.Samsung Tab). Many other phones can be charged as well using this port. Note that this port will not charge iPad.One-Year Limited Warranty","Bolse&reg; 4 Port Premium High Output USB Wall/Travel/AC Rapid Charger (4 Amps / 20Watt / Fastest Speed) For iPhone, iPad, Samsung Android Smartphones - Black",19.99
21,,DinoTwin T1 Premium Sport Bluetooth Wireless Stereo Headphones - Black/Red,64.16
22,"The design and quality is what stands out with this Hipo By Ivation Battery Pack, it is sleek, stylish, trendy and built to last! It has a 1A USB charging slot and can charge any device that charges VIA USB. However it only includes a MICRO USB cable so you will need a OEM Cable to charge any device that does not charge VIA MICRO USB. The 4 blue LED status indicators let you know how much charge power is remaining--when all four blue LEDs are on, you've got a full battery, and are ready to go! Charging times for devices depend on individual specifications.Compatible with Most Cell Phones:Apple:iPhone 5 4S 4 3 3GS / ipod touch/classic/nano/ iPad/ iPad 2(OEM Cable Required)HTCOne X V S / Sensation XE XL / Thunderbolt / EVO 3D / EVO 4G / Evo Shift 4gSamsungGalaxy S3 S2 / Note 1 2 / Epic 4G / Galaxy NexusBlackberryCurve / Storm 2 / Tour Style / BoldMotorolaDroid Razr Maxx / Atrix / BionicNokiaN900 / N8 / N97 / C6 / C3 C7 / E7 / X6LGOptimus , 2x , V , S , T / Quantum / VortexSonyExperia ARC Arc / Neo / Play / MiniAmazonKindle Fire, HD, DX and all other kindlesOthersNook Tablet, Color, NDS, Portable Wifi, PSP(NOT compatible with PSP vista)Specs:- Average Charging time for iPhones 1.5 hrs- Input Charging Time 5 - 6 hrs- Life Cycle &gt; 500 Times- Input: Micro USB 5V/1000mA(Max)- Output: USB 5V/1A (5W)Package Includes:EB-5200 Battery PackUser GuideMicro USB cable","Hipo By Ivation CS-5200 5200mAh (5V/1A output) Portable Power Bank External Backup Battery and Charger for all iPhones, iPods, iPads, phones, Smart Phones, Cambers, and any Electric item that Charges VIA USB",19.95
23,"The Aleratec Tunephonik iMX5 premium in-ear headset is packed with features without compromising design, ergonomics, or comfort.Using only premium quality drivers, it is capable of producing high fidelity acoustic sound and precise bass allowing listeners to enjoy soothing melodies, feel the ground-shaking rumble of an action-packed movie or just jam to their favorite music.The value-added in-line microphone filters out external noise, making it possible to communicate safely and with clarity. Conveniently designed access control buttons makes switching between phone calls and your favorite music a breeze. An L-shaped 90 degree 3.5mm jack and flat cord provides the exceptional durability for regular usage.Aleratec's top priority is to ensure that you are 100% satisfied with your purchase. This product comes with an ironclad 1-Year Limited Warranty. If you have any questions or issues, let us know. We'll do our best to give you the service you deserve.",Aleratec TunePhonik iMX5 In-Ear Headphones 3.5mm Premium Stereo Headset with In-line Microphone,19.99
24,"Bolse3.1A Dual USB Port High Output Car Charger easily charges your iPad, iPhone, iPod, HTC, Blackberry, MP3 Players, Digital Cameras, PDAs, Mobile Phones. This charger allows for two of your devices to be simultaneously charged while utilizing only one of your car's 12v DC power sockets. Charging will be automatically stop when battery is full.This charger charges tablets at 2 Amps and most phones at 1 Amps current.
This results in fastest possible charging of your device.Compatible:Port 1 (labeled as 1.0 Amp): Designed based on latest USB charging standard and will charge almost all devices, including iPhone / iPod Touch and other phones / GPS / Tablet etc.Port 2 (labeled as 2.1 Amp port): iPad, iPhone / iPod Touch and Others phones / GPS / Tablet etc. (May not support charging / or slow charging with some devices.)One-Year Limited Warranty",Bolse&reg; 3.1 Amp Dual USB Port High Output Car Charger 15w - Black,19.99
